{
  "schema_version": 1,
  "seq": 12,
  "task_id": "T-0042",
  "ts": "2026-10-13T06:30:00Z",
  "epoch": 0,
  "actor": {
    "kind": "factoryctl",
    "id": "factoryctl"
  },
  "type": "artifact_committed",
  "payload": {
    "stage": "spec",
    "label": "spec",
    "round": 1,
    "attempt": 1,
    "input_digest": "sha256:1111111111111111111111111111111111111111111111111111111111111111",
    "inputs": {
      "task.md": "sha256:2222222222222222222222222222222222222222222222222222222222222222",
      "triage.json": "sha256:3333333333333333333333333333333333333333333333333333333333333333"
    },
    "artifacts": [
      {
        "path": "spec.yaml",
        "digest": "sha256:4444444444444444444444444444444444444444444444444444444444444444"
      },
      {
        "path": "spec.md",
        "digest": "sha256:5555555555555555555555555555555555555555555555555555555555555555"
      }
    ]
  }
}
